{"$schema":"https://json-schema.org/draft/2020-12/schema","$id":"https://zkids.dev/schemas/episode.schema.json","title":"Episode","type":"object","additionalProperties":false,"required":["episode_id","series_id","title","language","duration_target","scenes"],"properties":{"episode_id":{"type":"string","minLength":1},"series_id":{"type":"string","minLength":1},"title":{"type":"string","minLength":1},"language":{"type":"string","minLength":2},"duration_target":{"type":"number","exclusiveMinimum":0},"max_retries_per_scene":{"type":"integer","minimum":0,"maximum":10},"budget_limit":{"type":"number","minimum":0},"scenes":{"type":"array","items":{"type":"object","additionalProperties":false,"required":["scene_id","start","duration","characters","action","camera"],"properties":{"scene_id":{"type":"string"},"start":{"type":"number","minimum":0},"duration":{"type":"number","exclusiveMinimum":0},"characters":{"type":"array","items":{"type":"string"}},"action":{"type":"string"},"camera":{"type":"object"},"dialogue":{"type":["string","null"]}}}}}}