{"episode_id":"EP001","series_id":"SERIES-001","title":"Mimi Finds the Red Apple","language":"th","duration_target":16,"max_retries_per_scene":3,"budget_limit":0,"scenes":[{"scene_id":"EP001-S001","start":0,"duration":8,"characters":["MIMI-001"],"action":"Mimi walks into the garden","camera":{"shot":"medium"},"dialogue":"ไปหาสีแดงกันเถอะ"},{"scene_id":"EP001-S002","start":8,"duration":8,"characters":["MIMI-001"],"action":"Mimi finds a red apple","camera":{"shot":"close-up"},"dialogue":"นี่คือแอปเปิลสีแดง"}]}